P06-2109,Trimming {CFG} Parse Trees for Sentence Compression Using Machine Learning Approaches,2006,13,18,3,0.0,49953,yuya unno,Proceedings of the {COLING}/{ACL} 2006 Main Conference Poster Sessions,0,0,0.9528595128712483,-0.6186477124253513
P06-1059,Improving the Scalability of Semi-{M}arkov Conditional Random Fields for Named Entity Recognition,2006,16,66,2,0.0,44082,daisuke okanohara,Proceedings of the 21st International Conference on Computational Linguistics and 44th Annual Meeting of the Association for Computational Linguistics,1,0,-0.0377670569191817,0.03721320584420234
P06-1128,Semantic Retrieval for the Accurate Identification of Relational Concepts in Massive Textbases,2006,18,83,1,1.0,5928,yusuke miyao,Proceedings of the 21st International Conference on Computational Linguistics and 44th Annual Meeting of the Association for Computational Linguistics,1,0,0.16269397634815747,-0.3730288255749161
W05-1510,Probabilistic Models for Disambiguation of an {HPSG}-Based Chart Generator,2005,22,48,2,0.0,50782,hiroko nakanishi,Proceedings of the Ninth International Workshop on Parsing Technology,0,0,0.3910190483446976,-1.0487318211806258
W05-1511,"Efficacy of Beam Thresholding, Unification Filtering and Hybrid Parsing in Probabilistic {HPSG} Parsing",2005,49,20,3,0.913043,3213,takashi ninomiya,Proceedings of the Ninth International Workshop on Parsing Technology,0,0,1.286378480140392,-1.5795949296483776
P05-1010,Probabilistic {CFG} with Latent Annotations,2005,16,236,2,1.0,32672,takuya matsuzaki,Proceedings of the 43rd Annual Meeting of the Association for Computational Linguistics ({ACL}{'}05),1,0,0.32938572527530635,-0.4638493217014945
P05-1011,Probabilistic Disambiguation Models for Wide-Coverage {HPSG} Parsing,2005,26,104,1,1.0,5928,yusuke miyao,Proceedings of the 43rd Annual Meeting of the Association for Computational Linguistics ({ACL}{'}05),1,0,0.6833486717719734,-0.7654661062124003
I05-1018,Adapting a Probabilistic Disambiguation Model of an {HPSG} Parser to a New Domain,2005,12,50,2,1.0,38278,tadayoshi hara,Second International Joint Conference on Natural Language Processing: Full Papers,0,0,1.1697466771392786,-0.8027090544011725
P04-3017,Finding Anchor Verbs for Biomedical {IE} Using Predicate-Argument Structures,2004,7,4,3,1.0,49766,akane yakushiji,Proceedings of the {ACL} Interactive Poster and Demonstration Sessions,0,0,0.3883808431489339,-0.381925164216235
C04-1204,Deep Linguistic Analysis for the Accurate Identification of Predicate-Argument Relations,2004,31,18,1,1.0,5928,yusuke miyao,{COLING} 2004: Proceedings of the 20th International Conference on Computational Linguistics,0,0,0.6695557147108484,-0.34312224788703755
W03-0401,A model of syntactic disambiguation based on lexicalized grammars,2003,22,7,1,1.0,5928,yusuke miyao,Proceedings of the Seventh Conference on Natural Language Learning at {HLT}-{NAACL} 2003,0,0,0.9133455223510075,-1.1107592203038676
W03-0416,An efficient clustering algorithm for class-based language models,2003,11,11,2,1.0,32672,takuya matsuzaki,Proceedings of the Seventh Conference on Natural Language Learning at {HLT}-{NAACL} 2003,0,0,-0.0806403799125463,-0.1165534499722581
P03-2033,A Debug Tool for Practical Grammar Development,2003,10,3,3,1.0,49766,akane yakushiji,The Companion Volume to the Proceedings of 41st Annual Meeting of the Association for Computational Linguistics,0,0,1.2073698179911112,-1.93813550417832
N03-2020,A Robust Retrieval Engine for Proximal and Structural Search,2003,5,6,3,0.0,49887,katsuya masuda,Companion Volume of the Proceedings of {HLT}-{NAACL} 2003 - Short Papers,0,0,-0.13033542970154843,0.1902513160430955
E03-1047,Lexicalized Grammar Acquisition,2003,8,7,1,1.0,5928,yusuke miyao,10th Conference of the {E}uropean Chapter of the Association for Computational Linguistics,0,0,1.8758000422177734,-1.6664398415965707
W02-2227,A Formal Proof of Strong Equivalence for a Grammar Conversion from {LTAG} to {HPSG}-style,2002,14,0,2,1.0,4617,naoki yoshinaga,Proceedings of the Sixth International Workshop on Tree Adjoining Grammar and Related Frameworks ({TAG}+6),0,0,1.8963786814365808,-1.6832809965926496
W02-2232,Clustering for obtaining syntactic classes of words from automatically extracted {LTAG} grammars,2002,5,2,2,1.0,38278,tadayoshi hara,Proceedings of the Sixth International Workshop on Tree Adjoining Grammar and Related Frameworks ({TAG}+6),0,0,1.1137608261063192,-0.961430679517788
C02-1100,Lenient Default Unification for Robust Processing within Unification Based Grammar Formalisms,2002,13,4,2,0.731707,3213,takashi ninomiya,{COLING} 2002: The 19th International Conference on Computational Linguistics,0,0,1.0139215029896416,-1.0843729951161523
W01-1510,Resource Sharing Amongst {HPSG} and {LTAG} Communities by a Method of Grammar Conversion between {FB}-{LTAG} and {HPSG},2001,23,0,2,1.0,4617,naoki yoshinaga,Proceedings of the {ACL} 2001 Workshop on Sharing Tools and Resources,0,0,2.0864659778247816,-1.6780250819483202
P99-1075,Packing of Feature Structures for Efficient Unification of Disjunctive Feature Structures,1999,13,7,1,1.0,5928,yusuke miyao,Proceedings of the 37th Annual Meeting of the Association for Computational Linguistics,1,0,0.6899669537821276,-0.5482826173061046
W98-0127,Packing of feature structures for optimizing the {HPSG}-style grammar translated from {TAG},1998,0,1,1,1.0,5928,yusuke miyao,Proceedings of the Fourth International Workshop on Tree Adjoining Grammars and Related Frameworks ({TAG}+4),0,0,0.8062591485307302,-0.808815500810017
W98-0141,Translating the {XTAG} {E}nglish grammar to {HPSG},1998,2,22,3,0.0,35318,yuka tateisi,Proceedings of the Fourth International Workshop on Tree Adjoining Grammars and Related Frameworks ({TAG}+4),0,0,1.6092880343334608,-1.7654227946619105
