2021.naacl-main.223,Game-theoretic Vocabulary Selection via the Shapley Value and Banzhaf Index,2021,-1,-1,4,0.0,3922,roma patel,Proceedings of the 2021 Conference of the North American Chapter of the Association for Computational Linguistics: Human Language Technologies,0,0,0.0,0.0
2021.findings-acl.25,Better {C}hinese Sentence Segmentation with Reinforcement Learning,2021,-1,-1,2,0.0,7553,srivatsan srinivasan,Findings of the Association for Computational Linguistics: ACL-IJCNLP 2021,0,0,0.0,0.0
2021.acl-long.104,Diverse Pretrained Context Encodings Improve Document Translation,2021,-1,-1,3,0.0,12847,domenic donato,Proceedings of the 59th Annual Meeting of the Association for Computational Linguistics and the 11th International Joint Conference on Natural Language Processing (Volume 1: Long Papers),1,0,0.0,0.0
2020.wmt-1.36,The {D}eep{M}ind {C}hinese{--}{E}nglish Document Translation System at {WMT}2020,2020,-1,-1,14,0.823529,8779,lei yu,Proceedings of the Fifth Conference on Machine Translation,0,0,0.0,0.0
2020.tacl-1.23,Better Document-Level Machine Translation with {B}ayes{'} Rule,2020,-1,-1,7,0.823529,8779,lei yu,Transactions of the Association for Computational Linguistics,0,0,0.0,0.0
2020.tacl-1.50,Syntactic Structure Distillation Pretraining for Bidirectional Encoders,2020,-1,-1,6,1.0,10041,adhiguna kuncoro,Transactions of the Association for Computational Linguistics,0,0,0.0,0.0
2020.findings-emnlp.106,Learning Robust and Multilingual Speech Representations,2020,47,2,3,1.0,19522,kazuya kawakami,Findings of the Association for Computational Linguistics: EMNLP 2020,0,0,0.008041194389573049,-0.23646182893825585
2020.acl-main.231,Learning to Segment Actions from Observation and Narration,2020,47,0,4,0.0,813,daniel fried,Proceedings of the 58th Annual Meeting of the Association for Computational Linguistics,1,0,0.2465397387970261,-0.3233486362814088
2020.acl-main.266,A Probabilistic Generative Model for Typographical Analysis of Early Modern Printing,2020,-1,-1,2,1.0,22755,kartik goyal,Proceedings of the 58th Annual Meeting of the Association for Computational Linguistics,1,0,0.0,0.0
P19-1228,Compound Probabilistic Context-Free Grammars for Grammar Induction,2019,0,6,2,0.0,2525,yoon kim,Proceedings of the 57th Annual Meeting of the Association for Computational Linguistics,1,0,0.8170319960776169,-1.5352446348569435
P19-1337,Scalable Syntax-Aware Language Models Using Knowledge Distillation,2019,0,2,2,1.0,10041,adhiguna kuncoro,Proceedings of the 57th Annual Meeting of the Association for Computational Linguistics,1,0,0.33282133964297705,-0.14938062939485172
P19-1645,"Learning to Discover, Ground and Use Words with Segmental Neural Language Models",2019,0,2,2,1.0,19522,kazuya kawakami,Proceedings of the 57th Annual Meeting of the Association for Computational Linguistics,1,0,-0.05600143163418515,-0.07450354818285555
N19-1114,Unsupervised Recurrent Neural Network Grammars,2019,0,10,5,0.0,2525,yoon kim,"Proceedings of the 2019 Conference of the North {A}merican Chapter of the Association for Computational Linguistics: Human Language Technologies, Volume 1 (Long and Short Papers)",0,0,0.1800318757939833,-0.4476589730936767
N19-1171,{A}n Empirical Investigation of Global and Local Normalization for Recurrent Neural Sequence Models Using a Continuous Relaxation to Beam Search,2019,0,0,2,1.0,22755,kartik goyal,"Proceedings of the 2019 Conference of the North {A}merican Chapter of the Association for Computational Linguistics: Human Language Technologies, Volume 1 (Long and Short Papers)",0,0,0.0,0.0
K19-1022,Comparing Top-Down and Bottom-Up Neural Generative Dependency Models,2019,0,0,3,1.0,26314,austin matthews,Proceedings of the 23rd Conference on Computational Natural Language Learning (CoNLL),0,0,0.2465397387970261,-0.3233486362814088
D19-1419,Achieving Verified Robustness to Symbol Substitutions via Interval Bound Propagation,2019,0,9,4,0.0,6952,posen huang,Proceedings of the 2019 Conference on Empirical Methods in Natural Language Processing and the 9th International Joint Conference on Natural Language Processing (EMNLP-IJCNLP),0,0,0.0,0.0
D19-1594,Text Genre and Training Data Size in Human-like Parsing,2019,0,0,4,0.0,11523,john hale,Proceedings of the 2019 Conference on Empirical Methods in Natural Language Processing and the 9th International Joint Conference on Natural Language Processing (EMNLP-IJCNLP),0,0,0.23185760743802142,-0.3886521694675594
Q18-1023,The {N}arrative{QA} Reading Comprehension Challenge,2018,3,94,4,1.0,28943,tomavs kovcisky,Transactions of the Association for Computational Linguistics,0,0,-0.2943849466263354,-0.35158901592655745
P18-1132,"{LSTM}s Can Learn Syntax-Sensitive Dependencies Well, But Modeling Structure Makes Them Better",2018,0,45,2,0.931035,10041,adhiguna kuncoro,Proceedings of the 56th Annual Meeting of the Association for Computational Linguistics (Volume 1: Long Papers),1,0,0.5395521994207387,-0.1657942191061485
P18-1254,Finding syntax in human encephalography with beam search,2018,31,9,2,0.0,11523,john hale,Proceedings of the 56th Annual Meeting of the Association for Computational Linguistics (Volume 1: Long Papers),1,0,0.4015683188424108,-0.4450167511149143
N18-1130,Using Morphological Knowledge in Open-Vocabulary Neural Language Models,2018,0,2,3,1.0,26314,austin matthews,"Proceedings of the 2018 Conference of the North {A}merican Chapter of the Association for Computational Linguistics: Human Language Technologies, Volume 1 (Long Papers)",0,0,-0.3168819187459087,-0.1448177841580719
D18-1412,Syntactic Scaffolds for Semantic Structures,2018,0,21,5,0.636364,5441,swabha swayamdipta,Proceedings of the 2018 Conference on Empirical Methods in Natural Language Processing,0,0,0.5395521994207387,-0.1657942191061485
P17-2058,Differentiable Scheduled Sampling for Credit Assignment,2017,17,10,2,1.0,22755,kartik goyal,Proceedings of the 55th Annual Meeting of the Association for Computational Linguistics (Volume 2: Short Papers),0,0,0.16436974803477422,-0.1311046709806066
P17-1015,Program Induction by Rationale Generation: Learning to Solve and Explain Algebraic Word Problems,2017,15,17,3,0.55795,13846,wang ling,Proceedings of the 55th Annual Meeting of the Association for Computational Linguistics (Volume 1: Long Papers),1,0,-0.031362483355824,-0.032453646393453
P17-1137,Learning to Create and Reuse Words in Open-Vocabulary Neural Language Modeling,2017,13,13,2,1.0,19522,kazuya kawakami,Proceedings of the 55th Annual Meeting of the Association for Computational Linguistics (Volume 1: Long Papers),1,0,0.5594390193983941,-0.7345997707887697
P17-1191,Ontology-Aware Token Embeddings for Prepositional Phrase Attachment,2017,21,3,3,0.0,4338,pradeep dasigi,Proceedings of the 55th Annual Meeting of the Association for Computational Linguistics (Volume 1: Long Papers),1,0,1.3122025203946999,-0.3118179350836018
K17-1001,Should Neural Network Architecture Reflect Linguistic Structure?,2017,0,0,1,1.0,3925,chris dyer,Proceedings of the 21st Conference on Computational Natural Language Learning ({C}o{NLL} 2017),0,0,-0.031362483355824,-0.032453646393453
J17-2002,Greedy Transition-Based Dependency Parsing with Stack {LSTM}s,2017,124,5,2,0.20288,3435,miguel ballesteros,Computational Linguistics,0,0,1.6714619949312788,-3.5254445567758625
E17-2061,Neural Machine Translation with Recurrent Attention Modeling,2017,7,24,4,0.857143,4270,zichao yang,"Proceedings of the 15th Conference of the {E}uropean Chapter of the Association for Computational Linguistics: Volume 2, Short Papers",0,0,0.18602794150012567,-0.25320349094068173
E17-1117,What Do Recurrent Neural Network Grammars Learn About Syntax?,2017,25,54,4,0.931035,10041,adhiguna kuncoro,"Proceedings of the 15th Conference of the {E}uropean Chapter of the Association for Computational Linguistics: Volume 1, Long Papers",0,0,0.8827039926693931,-1.152157941388254
D17-1197,Reference-Aware Language Models,2017,0,18,3,0.857143,4270,zichao yang,Proceedings of the 2017 Conference on Empirical Methods in Natural Language Processing,0,0,-0.05669898279125763,0.1210643702554397
W16-5904,Posterior regularization for Joint Modeling of Multiple Structured Prediction Tasks with Soft Constraints,2016,9,0,2,1.0,22755,kartik goyal,Proceedings of the Workshop on Structured Prediction for {NLP},0,0,0.0,0.0
W16-2506,Problems With Evaluation of Word Embeddings Using Word Similarity Tasks,2016,38,52,4,0.762578,8204,manaal faruqui,Proceedings of the 1st Workshop on Evaluating Vector-Space Representations for {NLP},0,0,-0.18366893218792057,-0.13180896227429156
W16-2520,Correlation-based Intrinsic Evaluation of Word Vector Representations,2016,21,0,3,0.70685,3965,yulia tsvetkov,Proceedings of the 1st Workshop on Evaluating Vector-Space Representations for {NLP},0,0,0.5395521994207387,-0.1657942191061485
W16-2360,Attention-based Multimodal Neural Machine Translation,2016,16,48,5,0.0,3844,poyao huang,"Proceedings of the First Conference on Machine Translation: Volume 2, Shared Task Papers",0,0,0.18602794150012567,-0.25320349094068173
S16-1186,{CMU} at {S}em{E}val-2016 Task 8: Graph-based {AMR} Parsing with Infinite Ramp Loss,2016,10,11,2,0.8125,12665,jeffrey flanigan,Proceedings of the 10th International Workshop on Semantic Evaluation ({S}em{E}val-2016),0,0,0.06767810891876584,-0.47698899710557247
Q16-1031,"Many Languages, One Parser",2016,44,8,4,0.909091,23186,waleed ammar,Transactions of the Association for Computational Linguistics,0,0,1.4576344047887455,-1.508530153504378
P16-1013,Learning the Curriculum with {B}ayesian Optimization for Task-Specific Word Representation Learning,2016,42,4,5,0.70685,3965,yulia tsvetkov,Proceedings of the 54th Annual Meeting of the Association for Computational Linguistics (Volume 1: Long Papers),1,0,-0.18202329447879134,-0.37287726652617836
P16-1103,Synthesizing Compound Words for Machine Translation,2016,25,4,4,1.0,26314,austin matthews,Proceedings of the 54th Annual Meeting of the Association for Computational Linguistics (Volume 1: Long Papers),1,0,0.07971113161754373,-0.8538632020770504
P16-1157,Cross-lingual Models of Word Embeddings: An Empirical Comparison,2016,34,55,3,0.0,8203,shyam upadhyay,Proceedings of the 54th Annual Meeting of the Association for Computational Linguistics (Volume 1: Long Papers),1,0,0.1133324477376935,-0.09169880842267397
N16-1024,Recurrent Neural Network Grammars,2016,43,106,1,1.0,3925,chris dyer,Proceedings of the 2016 Conference of the North {A}merican Chapter of the Association for Computational Linguistics: Human Language Technologies,0,0,0.4818508625759841,-0.9561755805287954
N16-1030,Neural Architectures for Named Entity Recognition,2016,17,1017,5,0.0,19749,guillaume lample,Proceedings of the 2016 Conference of the North {A}merican Chapter of the Association for Computational Linguistics: Human Language Technologies,0,0,-0.15255411042939618,0.2305049347044116
N16-1077,Morphological Inflection Generation Using Character Sequence to Sequence Learning,2016,51,22,4,0.762578,8204,manaal faruqui,Proceedings of the 2016 Conference of the North {A}merican Chapter of the Association for Computational Linguistics: Human Language Technologies,0,0,-0.031362483355824,-0.032453646393453
N16-1087,Generation from {A}bstract {M}eaning {R}epresentation using Tree Transducers,2016,20,38,2,0.8125,12665,jeffrey flanigan,Proceedings of the 2016 Conference of the North {A}merican Chapter of the Association for Computational Linguistics: Human Language Technologies,0,0,-0.031362483355824,-0.032453646393453
N16-1102,Incorporating Structural Alignment Biases into an Attentional Neural Translation Model,2016,22,11,5,0.0,1787,trevor cohn,Proceedings of the 2016 Conference of the North {A}merican Chapter of the Association for Computational Linguistics: Human Language Technologies,0,0,0.24456229026398799,-0.3063689496430935
N16-1161,Polyglot Neural Language Models: A Case Study in Cross-Lingual Phonetic Representation Learning,2016,36,25,9,0.70685,3965,yulia tsvetkov,Proceedings of the 2016 Conference of the North {A}merican Chapter of the Association for Computational Linguistics: Human Language Technologies,0,0,-0.2896506149580099,-0.028997807924352036
N16-1174,Hierarchical Attention Networks for Document Classification,2016,35,1037,3,0.857143,4270,zichao yang,Proceedings of the 2016 Conference of the North {A}merican Chapter of the Association for Computational Linguistics: Human Language Technologies,0,0,-0.013626393947260868,-0.4172205464717625
L16-1529,"Bridge-Language Capitalization Inference in {W}estern {I}ranian: {S}orani, {K}urmanji, Zazaki, and {T}ajik",2016,0,3,4,0.0,12351,patrick littell,Proceedings of the Tenth International Conference on Language Resources and Evaluation ({LREC}'16),0,0,-0.031362483355824,-0.032453646393453
K16-1019,"Greedy, Joint Syntactic-Semantic Parsing with Stack {LSTM}s",2016,42,5,3,0.636364,5441,swabha swayamdipta,Proceedings of The 20th {SIGNLL} Conference on Computational Natural Language Learning,0,0,0.19460546423519634,-0.008507246795313603
J16-2005,Mining Parallel Corpora from {S}ina {W}eibo and {T}witter,2016,43,2,3,0.583974,13846,wang ling,Computational Linguistics,0,0,0.7304077327777273,-0.3649861855814709
D16-2001,Practical Neural Networks for {NLP}: From Theory to Code,2016,-1,-1,1,1.0,3925,chris dyer,Proceedings of the 2016 Conference on Empirical Methods in Natural Language Processing: Tutorial Abstracts,0,0,0.0,0.0
D16-1116,Semantic Parsing with Semi-Supervised Sequential Autoencoders,2016,29,28,4,1.0,28943,tomavs kovcisky,Proceedings of the 2016 Conference on Empirical Methods in Natural Language Processing,0,0,0.8386570198791246,-1.6638545571086791
D16-1124,Generalizing and Hybridizing Count-based and Neural Language Models,2016,29,8,2,0.0,834,graham neubig,Proceedings of the 2016 Conference on Empirical Methods in Natural Language Processing,0,0,-0.3168819187459087,-0.1448177841580719
D16-1153,Phonologically Aware Neural Model for Named Entity Recognition in Low Resource Transfer Settings,2016,16,27,3,0.0,23087,akash bharadwaj,Proceedings of the 2016 Conference on Empirical Methods in Natural Language Processing,0,0,-0.05302067682117545,0.0896451735666221
D16-1180,Distilling an Ensemble of Greedy Dependency Parsers into One {MST} Parser,2016,38,23,4,0.868421,10041,adhiguna kuncoro,Proceedings of the 2016 Conference on Empirical Methods in Natural Language Processing,0,0,1.3626672345050483,-2.635961443457879
D16-1202,Character Sequence Models for Colorful Words,2016,25,1,2,1.0,19522,kazuya kawakami,Proceedings of the 2016 Conference on Empirical Methods in Natural Language Processing,0,0,-0.031362483355824,-0.032453646393453
D16-1211,Training with Exploration Improves a Greedy Stack {LSTM} Parser,2016,27,6,3,0.254859,3435,miguel ballesteros,Proceedings of the 2016 Conference on Empirical Methods in Natural Language Processing,0,0,0.23185760743802142,-0.3886521694675594
D16-1254,Transition-Based Dependency Parsing with Heuristic Backtracking,2016,13,5,3,0.0,28956,jacob buckman,Proceedings of the 2016 Conference on Empirical Methods in Natural Language Processing,0,0,1.2778388397087845,-1.5474207655460503
C16-1018,The Role of Context in Neural Morphological Disambiguation,2016,0,13,5,0.0,2580,qinlan shen,"Proceedings of {COLING} 2016, the 26th International Conference on Computational Linguistics: Technical Papers",0,0,-0.031362483355824,-0.032453646393453
C16-1095,Named Entity Recognition for Linguistic Rapid Response in Low-Resource Languages: {S}orani {K}urdish and {T}ajik,2016,0,3,5,0.0,12351,patrick littell,"Proceedings of {COLING} 2016, the 26th International Conference on Computational Linguistics: Technical Papers",0,0,-0.05302067682117545,0.0896451735666221
C16-1328,{P}an{P}hon: A Resource for Mapping {IPA} Segments to Articulatory Feature Vectors,2016,0,8,5,0.0,9801,david mortensen,"Proceedings of {COLING} 2016, the 26th International Conference on Computational Linguistics: Technical Papers",0,0,0.0,0.0
P15-2021,Lexicon Stratification for Translating Out-of-Vocabulary Words,2015,30,5,2,0.810275,3965,yulia tsvetkov,Proceedings of the 53rd Annual Meeting of the Association for Computational Linguistics and the 7th International Joint Conference on Natural Language Processing (Volume 2: Short Papers),0,0,-0.7651963728561695,-0.3532575186550213
P15-2036,Frame-Semantic Role Labeling with Heterogeneous Annotations,2015,32,23,6,0.0,37420,meghana kshirsagar,Proceedings of the 53rd Annual Meeting of the Association for Computational Linguistics and the 7th International Joint Conference on Natural Language Processing (Volume 2: Short Papers),0,0,1.1497971874371495,-0.5371821081028468
P15-2076,Non-distributional Word Vector Representations,2015,40,14,2,0.866667,8204,manaal faruqui,Proceedings of the 53rd Annual Meeting of the Association for Computational Linguistics and the 7th International Joint Conference on Natural Language Processing (Volume 2: Short Papers),0,0,0.0142163675454156,-0.1539961276039285
P15-2105,Automatic Keyword Extraction on {T}witter,2015,39,24,4,0.666667,26032,luis marujo,Proceedings of the 53rd Annual Meeting of the Association for Computational Linguistics and the 7th International Joint Conference on Natural Language Processing (Volume 2: Short Papers),0,0,0.08253888102482004,-0.1778168538839792
P15-1033,Transition-Based Dependency Parsing with Stack Long Short-Term Memory,2015,48,90,1,1.0,3925,chris dyer,Proceedings of the 53rd Annual Meeting of the Association for Computational Linguistics and the 7th International Joint Conference on Natural Language Processing (Volume 1: Long Papers),1,0,1.4012666981372826,-1.72495070466349
P15-1077,{G}aussian {LDA} for Topic Models with Word Embeddings,2015,28,145,3,0.0,10147,rajarshi das,Proceedings of the 53rd Annual Meeting of the Association for Computational Linguistics and the 7th International Joint Conference on Natural Language Processing (Volume 1: Long Papers),1,0,-0.4127510837059888,-0.009249526924205801
P15-1081,Unifying {B}ayesian Inference and Vector Space Models for Improved Decipherment,2015,23,12,4,0.0,30565,qing dou,Proceedings of the 53rd Annual Meeting of the Association for Computational Linguistics and the 7th International Joint Conference on Natural Language Processing (Volume 1: Long Papers),1,0,-0.031362483355824,-0.032453646393453
P15-1144,Sparse Overcomplete Word Vector Representations,2015,58,84,4,0.866667,8204,manaal faruqui,Proceedings of the 53rd Annual Meeting of the Association for Computational Linguistics and the 7th International Joint Conference on Natural Language Processing (Volume 1: Long Papers),1,0,-0.6976546515203718,0.9060002964671121
N15-1062,Constraint-Based Models of Lexical Borrowing,2015,44,9,3,0.810275,3965,yulia tsvetkov,Proceedings of the 2015 Conference of the North {A}merican Chapter of the Association for Computational Linguistics: Human Language Technologies,0,0,0.019018228051650033,-0.09314639254345505
N15-1070,Ontologically Grounded Multi-sense Representation Learning for Semantic Vector Space Models,2015,38,58,2,0.0,3909,sujay jauhar,Proceedings of the 2015 Conference of the North {A}merican Chapter of the Association for Computational Linguistics: Human Language Technologies,0,0,-0.39164748870669924,0.6066575143864139
N15-1142,Two/Too Simple Adaptations of {W}ord2{V}ec for Syntax Problems,2015,23,194,2,0.739053,13846,wang ling,Proceedings of the 2015 Conference of the North {A}merican Chapter of the Association for Computational Linguistics: Human Language Technologies,0,0,1.1937519990425176,-0.3950448105809361
N15-1144,Unsupervised {POS} Induction with Word Embeddings,2015,20,18,3,1.0,4430,chucheng lin,Proceedings of the 2015 Conference of the North {A}merican Chapter of the Association for Computational Linguistics: Human Language Technologies,0,0,-0.43500268816258997,-0.1589499512509788
N15-1184,Retrofitting Word Vectors to Semantic Lexicons,2015,52,247,4,0.866667,8204,manaal faruqui,Proceedings of the 2015 Conference of the North {A}merican Chapter of the Association for Computational Linguistics: Human Language Technologies,0,0,-0.151494420669946,-0.06196961803434195
K15-1003,A Supertag-Context Model for Weakly-Supervised {CCG} Parser Learning,2015,26,2,2,0.666667,8780,dan garrette,Proceedings of the Nineteenth Conference on Computational Natural Language Learning,0,0,1.5036291769507073,-2.120125442952944
J15-1007,Book Reviews: Linguistic Fundamentals for Natural Language Processing: 100 Essentials from Morphology and Syntax by Emily {M}. Bender,2015,0,0,1,1.0,3925,chris dyer,Computational Linguistics,0,0,0.5395521994207387,-0.1657942191061485
D15-1041,Improved Transition-based Parsing by Modeling Characters instead of Words with {LSTM}s,2015,47,57,2,0.254859,3435,miguel ballesteros,Proceedings of the 2015 Conference on Empirical Methods in Natural Language Processing,0,0,1.0764789024173005,-1.217905709857255
D15-1161,Not All Contexts Are Created Equal: Better Word Representations with Variable Attention,2015,24,93,5,0.739053,13846,wang ling,Proceedings of the 2015 Conference on Empirical Methods in Natural Language Processing,0,0,0.11065500702387882,0.42252433958893576
D15-1176,Finding Function in Form: Compositional Character Models for Open Vocabulary Word Representation,2015,34,265,2,0.739053,13846,wang ling,Proceedings of the 2015 Conference on Empirical Methods in Natural Language Processing,0,0,-0.25892814998646474,-0.34979820722370847
D15-1243,Evaluation of Word Vector Representations by Subspace Alignment,2015,27,85,5,0.810275,3965,yulia tsvetkov,Proceedings of the 2015 Conference on Empirical Methods in Natural Language Processing,0,0,0.0,0.0
D15-1284,Humor Recognition and Humor Anchor Extraction,2015,25,41,3,0.333333,894,diyi yang,Proceedings of the 2015 Conference on Empirical Methods in Natural Language Processing,0,0,0.2776337335288787,-0.19511070700392805
W14-3909,The {CMU} Submission for the Shared Task on Language Identification in Code-Switched Data,2014,16,10,4,1.0,4430,chucheng lin,Proceedings of the First Workshop on Computational Approaches to Code Switching,0,0,-0.09265016078755875,0.03463755086508184
W14-3315,The {CMU} Machine Translation Systems at {WMT} 2014,2014,24,7,10,1.0,26314,austin matthews,Proceedings of the Ninth Workshop on Statistical Machine Translation,0,0,0.5708474342391003,-0.7016832616673492
W14-3356,Crowdsourcing High-Quality Parallel Data Extraction from {T}witter,2014,23,10,3,1.0,13846,wang ling,Proceedings of the Ninth Workshop on Statistical Machine Translation,0,0,0.31956194447127756,-0.2880582498319222
W14-1615,Weakly-Supervised {B}ayesian Learning of a {CCG} Supertagger,2014,33,4,2,0.666667,8780,dan garrette,Proceedings of the Eighteenth Conference on Computational Natural Language Learning,0,0,1.8691522223918484,-1.6338083356263984
W14-0311,Real Time Adaptive Machine Translation for Post-Editing with cdec and {T}rans{C}enter,2014,17,16,4,0.645161,20879,michael denkowski,Proceedings of the {EACL} 2014 Workshop on Humans and Computer-assisted Translation,0,0,1.1386716406744062,-0.005434058973063066
S14-2027,"{CMU}: Arc-Factored, Discriminative Semantic Dependency Parsing",2014,16,7,8,0.857143,3932,sam thomson,Proceedings of the 8th International Workshop on Semantic Evaluation ({S}em{E}val 2014),0,0,0.8514568922327371,-1.4312446326190698
Q14-1016,Discriminative Lexical Semantic Segmentation with Gaps: Running the {MWE} Gamut,2014,64,44,3,0.72093,794,nathan schneider,Transactions of the Association for Computational Linguistics,0,0,0.2776337335288787,-0.19511070700392805
Q14-1031,Locally Non-Linear Learning for Statistical Machine Translation via Discretization and Structured Regularization,2014,48,3,2,0.768729,3375,jonathan clark,Transactions of the Association for Computational Linguistics,0,0,0.18602794150012567,-0.25320349094068173
P14-5004,Community Evaluation and Exchange of Word Vectors at wordvectors.org,2014,24,62,2,1.0,8204,manaal faruqui,Proceedings of 52nd Annual Meeting of the Association for Computational Linguistics: System Demonstrations,0,0,-0.6976546515203718,0.9060002964671121
P14-5021,Simplified Dependency Annotations with {GFL}-Web,2014,14,4,3,0.0,39116,michael mordowanec,Proceedings of 52nd Annual Meeting of the Association for Computational Linguistics: System Demonstrations,0,0,0.5395521994207387,-0.1657942191061485
P14-2134,Distributed Representations of Geographically Situated Language,2014,31,41,2,0.0,2590,david bamman,Proceedings of the 52nd Annual Meeting of the Association for Computational Linguistics (Volume 2: Short Papers),0,0,-0.14516295422200823,0.12911788277936184
P14-1024,Metaphor Detection with Cross-Lingual Model Transfer,2014,42,67,5,0.810275,3965,yulia tsvetkov,Proceedings of the 52nd Annual Meeting of the Association for Computational Linguistics (Volume 1: Long Papers),1,0,-0.10137477023265296,-0.07197867204053585
P14-1134,A Discriminative Graph-Based Parser for the {A}bstract {M}eaning {R}epresentation,2014,39,141,4,1.0,12665,jeffrey flanigan,Proceedings of the 52nd Annual Meeting of the Association for Computational Linguistics (Volume 1: Long Papers),1,0,0.23185760743802142,-0.3886521694675594
tsvetkov-etal-2014-augmenting-english,Augmenting {E}nglish Adjective Senses with Supersenses,2014,19,22,6,0.810275,3965,yulia tsvetkov,Proceedings of the Ninth International Conference on Language Resources and Evaluation ({LREC}'14),0,0,-0.6092226807990795,0.2866387134823764
bhatia-etal-2014-unified,A Unified Annotation Scheme for the Semantic/Pragmatic Components of Definiteness,2014,19,4,5,0.0,11651,archna bhatia,Proceedings of the Ninth International Conference on Language Resources and Evaluation ({LREC}'14),0,0,-0.42952706539853064,0.02134887518421577
zhang-etal-2014-dual,Dual Subtitles as Parallel Corpora,2014,40,8,3,0.0,4115,shikun zhang,Proceedings of the Ninth International Conference on Language Resources and Evaluation ({LREC}'14),0,0,0.692824746082157,0.163609048237418
